{
  "$schema": "./calendar.schema.json",
  "schema_version": 1,
  "channel": "Plot Armor Facts",
  "month": "2026-10",
  "timezone": "Europe/London",
  "slots": {
    "p1": {
      "label": "morning",
      "time": "09:00"
    },
    "p2": {
      "label": "afternoon",
      "time": "15:00"
    },
    "p3": {
      "label": "night",
      "time": "21:00"
    }
  },
  "series": [
    {
      "series_id": "2026-10-01-crows-remember-faces",
      "date": "2026-10-01",
      "category": "nature",
      "series_title": "The Crows That Never Forgot a Face",
      "throughline": "How did Seattle crows learn to hate one caveman mask, pass the grudge to crows that were never caught, and how long did it last?",
      "sources": [
        {
          "title": "John Marzluff - Wikipedia",
          "url": "https://en.wikipedia.org/wiki/John_Marzluff"
        },
        {
          "title": "Crows Remember a Face...for a Long Time! - John M. Marzluff, Yale University Press",
          "url": "https://yalebooks.yale.edu/2025/01/21/crows-remember-a-facefor-a-long-time/"
        },
        {
          "title": "Crows Don't Forget a Human Face, But We Can't Recognize Individual Crows - Audubon",
          "url": "https://www.audubon.org/news/crows-dont-forget-human-face-we-cant-recognize-individual-crows"
        },
        {
          "title": "Crows react to threats in human-like way: Neural basis of crows' knack for face recognition - Phys.org",
          "url": "https://phys.org/news/2012-09-crows-react-threats-human-like-neural.html"
        },
        {
          "title": "Brain imaging reveals neuronal circuitry underlying the crow's perception of human faces - PNAS",
          "url": "https://www.pnas.org/doi/10.1073/pnas.1206109109"
        }
      ],
      "episodes": [
        {
          "episode_id": "2026-10-01-crows-remember-faces-p1",
          "date": "2026-10-01",
          "part": "p1",
          "slot": "morning",
          "series_id": "2026-10-01-crows-remember-faces",
          "series_title": "The Crows That Never Forgot a Face",
          "episode_title": "The Man in the Caveman Mask",
          "youtube_title": "The Crows That Never Forgot a Face (Part 1/3)",
          "script": "Crows can hold a grudge against a human face for years. One scientist proved it with a caveman mask. Biologist John Marzluff studied the crows on a Seattle university campus. His team trapped crows to band them, all while wearing that mask. They caught just seven crows, banded their legs, and let them go. Later, people wore that same mask on calm walks across campus. Crows screamed at the masked walker and gathered to mob him. But some of the scolding crows had never been trapped at all. Subscribe so you don't miss Part 2.",
          "cliffhanger": "But some of the scolding crows had never been trapped at all.",
          "video_terms": [
            "crow close up",
            "bird cawing",
            "person wearing halloween mask",
            "university campus",
            "crow walking on grass",
            "crow eating",
            "crows flying",
            "man in scary mask",
            "crow on branch",
            "flock of crows",
            "crows on bare tree",
            "crow perched on fence"
          ],
          "description": "A scientist wore a caveman mask to catch a few crows, and the whole campus seemed to remember. Has a bird ever held a grudge against you?",
          "tags": [
            "crows",
            "crow intelligence",
            "animal memory",
            "birds",
            "science experiment",
            "true story"
          ]
        },
        {
          "episode_id": "2026-10-01-crows-remember-faces-p2",
          "date": "2026-10-01",
          "part": "p2",
          "slot": "afternoon",
          "series_id": "2026-10-01-crows-remember-faces",
          "series_title": "The Crows That Never Forgot a Face",
          "episode_title": "A Grudge That Spread",
          "youtube_title": "The Crows That Never Forgot a Face (Part 2/3)",
          "script": "Crows that were never caught learned to hate the mask anyway. In Part 1, scientists trapped seven crows while wearing a caveman mask. Walkers also wore a neutral mask, and crows mostly ignored it. The caveman face alone set them off. For seven years, more and more crows joined in. Scientists found evidence that crows learned by watching others scold. Across twelve years, roughly four in ten crows they passed scolded the caveman. Then scientists looked inside crow brains to see what that face did. Subscribe so you don't miss Part 3.",
          "cliffhanger": "Then scientists looked inside crow brains to see what that face did.",
          "video_terms": [
            "crow close up",
            "man in scary mask",
            "person wearing halloween mask",
            "crow walking on grass",
            "bird cawing",
            "flock of crows",
            "crow on branch",
            "crows flying",
            "crows on bare tree",
            "mri machine",
            "crow eating"
          ],
          "description": "Crows that were never caught still scolded the caveman mask, and the grudge kept spreading for years. Do you think crows gossip?",
          "tags": [
            "crows",
            "crow intelligence",
            "social learning",
            "birds",
            "animal memory",
            "true story"
          ]
        },
        {
          "episode_id": "2026-10-01-crows-remember-faces-p3",
          "date": "2026-10-01",
          "part": "p3",
          "slot": "night",
          "series_id": "2026-10-01-crows-remember-faces",
          "series_title": "The Crows That Never Forgot a Face",
          "episode_title": "Inside a Crow's Grudge",
          "youtube_title": "The Crows That Never Forgot a Face (Part 3/3)",
          "script": "Crow brains react to a dangerous face much like ours do. In Part 2, crows that were never caught learned to scold the mask. In a later study, researchers scanned the brains of captive wild crows. Crows saw a mask linked to capture, or one linked to feeding. The threatening face lit up regions tied to emotion, much like our amygdala. Back on campus, the caveman kept getting scolded for years. Nearly two decades after the trapping, crows finally ignored him. Wrong a crow, and the whole flock may remember. Subscribe for a new true story every day.",
          "cliffhanger": "",
          "video_terms": [
            "crow close up",
            "crow on branch",
            "man in scary mask",
            "mri machine",
            "person wearing halloween mask",
            "crow eating",
            "brain scan",
            "university campus",
            "bird cawing",
            "crow walking on grass",
            "flock of crows",
            "crows flying"
          ],
          "description": "Brain scans showed a scary face lighting up emotion areas in crow brains, and the campus grudge lasted nearly two decades. Would you want a crow as a friend or an enemy?",
          "tags": [
            "crows",
            "crow brain",
            "animal memory",
            "birds",
            "neuroscience",
            "true story"
          ]
        }
      ]
    },
    {
      "series_id": "2026-10-02-lightning-ranger",
      "date": "2026-10-02",
      "category": "science",
      "series_title": "The Ranger Lightning Hit Seven Times",
      "throughline": "How did one park ranger survive seven lightning strikes, and why do lightning's odds hit people like him so much harder?",
      "sources": [
        {
          "title": "Roy Sullivan - Wikipedia",
          "url": "https://en.wikipedia.org/wiki/Roy_Sullivan"
        },
        {
          "title": "Incredible story of man who survived being struck by lightning seven times - Guinness World Records",
          "url": "https://www.guinnessworldrecords.com/news/2023/1/incredible-story-of-man-who-survived-being-struck-by-lightning-seven-times-733932"
        },
        {
          "title": "How Dangerous is Lightning? - National Weather Service",
          "url": "https://www.weather.gov/safety/lightning-odds"
        },
        {
          "title": "Lightning Myths - National Weather Service",
          "url": "https://www.weather.gov/safety/lightning-myths"
        },
        {
          "title": "Lightning Strike Victim Data - CDC",
          "url": "https://cdc.gov/lightning/data-research/index.html"
        }
      ],
      "episodes": [
        {
          "episode_id": "2026-10-02-lightning-ranger-p1",
          "date": "2026-10-02",
          "part": "p1",
          "slot": "morning",
          "series_id": "2026-10-02-lightning-ranger",
          "series_title": "The Ranger Lightning Hit Seven Times",
          "episode_title": "The First Bolt at a Burning Lookout Tower",
          "youtube_title": "The Ranger Lightning Hit Seven Times (Part 1/3)",
          "script": "Lightning never strikes the same place twice? It hit one ranger seven times. Most people will never be struck even once. He was Roy Sullivan, a park ranger in Virginia's Shenandoah National Park. His first strike came at a fire lookout tower. Lightning set the tower on fire, and he ran out into the storm. A bolt hit his leg and blew a hole in his shoe. He survived with burns and a missing toenail. But the next bolt would find him inside his truck. Subscribe so you don't miss Part 2.",
          "cliffhanger": "But the next bolt would find him inside his truck.",
          "video_terms": [
            "thunderstorm lightning",
            "lightning storm mountains",
            "hikers on mountain trail",
            "forest ranger hat",
            "wooden watchtower in forest",
            "barn fire",
            "man running in rain",
            "old leather boot",
            "man walking in forest",
            "storm clouds forest",
            "old pickup truck"
          ],